<?xml version="1.0" encoding="UTF-8"?>
<LibrarySystem xmlns:xsi="http://www.w3.org/2001/XMLSchema-instance" xsi:noNamespaceSchemaLocation="schema-1.xsd">
  <Libraries>
    <!-- First Library -->
    <Library>
      <Name xml:lang="en">City Library</Name>
      <Address xml:lang="en">Italska 70</Address>
      <Books>
        <Book>
          <BookID>65</BookID>
          <ISBN>147258</ISBN>
          <Title xml:lang="en">Forth Wing</Title>
          <PublishYear>2022</PublishYear>
          <CopiesAvailable>1</CopiesAvailable>
          <Author>
            <AuthorID>8456</AuthorID>
            <Name xml:lang="en">Dwayne</Name>
            <ContactInformation>
              <PhoneNumber>987654325</PhoneNumber>
              <Email>dwayne.doe@library.com</Email>
              <DeliveryAddress xml:lang="en">30 Memorial Drive, Avon MA 2322</DeliveryAddress>
            </ContactInformation>
          </Author>
        </Book>
      </Books>
      <Librarians>
        <Librarian>
          <EmployeeID>165</EmployeeID>
          <Name xml:lang="en">Natalie</Name>
          <ContactInformation>
            <PhoneNumber>123456789</PhoneNumber>
            <Email>natalie@def.com</Email>
          </ContactInformation>
        </Librarian>
      </Librarians>
      <Members>
        <Member>
          <MemberID>514986</MemberID>
          <Name xml:lang="en">George</Name>
          <ContactInformation>
            <PhoneNumber>987654323</PhoneNumber>
            <Email>george.doe@library.com</Email>
          </ContactInformation>
        </Member>
      </Members>
    </Library>

    <!-- Second Library -->
    <Library>
      <Name xml:lang="en">Central Library</Name>
      <Address xml:lang="en">Main Street 123</Address>
      <Books>
        <Book>
          <BookID>66</BookID>
          <ISBN>147259</ISBN>
          <Title xml:lang="en">East of Eden</Title>
          <PublishYear>1952</PublishYear>
          <Author>
            <AuthorID>8457</AuthorID>
            <Name xml:lang="en">John</Name>
            <ContactInformation>
              <PhoneNumber>987654324</PhoneNumber>
              <Email>john_2.doe@library.com</Email>
              <DeliveryAddress xml:lang="en">777 Brockton Avenue, Abington MA 2351</DeliveryAddress>
            </ContactInformation>
          </Author>
        </Book>
      </Books>
      <Librarians>
        <Librarian>
          <EmployeeID>167</EmployeeID>
          <Name xml:lang="en">John</Name>
          <ContactInformation>
            <PhoneNumber>987654322</PhoneNumber>
            <Email>john.doe@library.com</Email>
          </ContactInformation>
        </Librarian>
      </Librarians>
      <Members>
        <Member>
          <MemberID>514987</MemberID>
          <Name xml:lang="en">Jane</Name>
          <ContactInformation>
            <PhoneNumber>987654321</PhoneNumber>
            <Email>jane.doe@library.com</Email>
          </ContactInformation>
        </Member>
      </Members>
    </Library>

    <!-- Third Library -->
    <Library>
      <Name xml:lang="en">Eastern Library</Name>
      <Address xml:lang="en">East Street 321</Address>
      <Books>
        <Book>
          <BookID>64</BookID>
          <ISBN>147257</ISBN>
          <Title xml:lang="en">Hard to Be a God</Title>
          <PublishYear>1964</PublishYear>
          <CopiesAvailable>10</CopiesAvailable>
          <Author>
            <AuthorID>8455</AuthorID>
            <Name xml:lang="en">Boris</Name>
            <ContactInformation>
              <PhoneNumber>987654328</PhoneNumber>
              <Email>boris.doe@library.com</Email>
              <DeliveryAddress xml:lang="en">591 Memorial Dr, Chicopee MA 1020</DeliveryAddress>
            </ContactInformation>
          </Author>
        </Book>
        <Book>
          <BookID>66</BookID>
          <ISBN>147259</ISBN>
          <Title xml:lang="en">East of Eden</Title>
          <PublishYear>1952</PublishYear>
          <Author>
            <AuthorID>8457</AuthorID>
            <Name xml:lang="en">John</Name>
            <ContactInformation>
              <PhoneNumber>987654324</PhoneNumber>
              <Email>john_2.doe@library.com</Email>
              <DeliveryAddress xml:lang="en">777 Brockton Avenue, Abington MA 2351</DeliveryAddress>
            </ContactInformation>
          </Author>
        </Book>
        <Book>
          <BookID>65</BookID>
          <ISBN>147258</ISBN>
          <Title xml:lang="en">Forth Wing</Title>
          <PublishYear>2022</PublishYear>
          <CopiesAvailable>1</CopiesAvailable>
          <Author>
            <AuthorID>8456</AuthorID>
            <Name xml:lang="en">Dwayne</Name>
            <ContactInformation>
              <PhoneNumber>987654325</PhoneNumber>
              <Email>dwayne.doe@library.com</Email>
              <DeliveryAddress xml:lang="en">30 Memorial Drive, Avon MA 2322</DeliveryAddress>
            </ContactInformation>
          </Author>
        </Book>
      </Books>
      <Librarians>
        <Librarian>
          <EmployeeID>169</EmployeeID>
          <Name xml:lang="en">Ben</Name>
          <ContactInformation>
            <PhoneNumber>987654326</PhoneNumber>
            <Email>ben.doe@library.com</Email>
            <DeliveryAddress xml:lang="en">250 Hartford Avenue, Bellingham MA 2019</DeliveryAddress>
          </ContactInformation>
        </Librarian>
      </Librarians>
      <Members>
        <Member>
          <MemberID>514988</MemberID>
          <Name xml:lang="en">Michael</Name>
          <ContactInformation>
            <PhoneNumber>987654327</PhoneNumber>
            <Email>michael.doe@library.com</Email>
            <DeliveryAddress xml:lang="en">700 Oak Street, Brockton MA 2301</DeliveryAddress>
          </ContactInformation>
        </Member>
        <Member>
          <MemberID>514987</MemberID>
          <Name xml:lang="en">Jane</Name>
          <ContactInformation>
            <PhoneNumber>987654321</PhoneNumber>
            <Email>jane.doe@library.com</Email>
          </ContactInformation>
        </Member>
      </Members>
    </Library>
  </Libraries>
</LibrarySystem>
